[
  {
    "country": "South Africa",
    "provider_name": "WesBank Fleet Management and Leasing",
    "product_name": "Lease Agreements",
    "product_type": "Vehicle lease / business vehicle rental",
    "target_customer": "Business and fleet customers",
    "product_description": "Business vehicle leasing/rental for single vehicles through to fleets, with maintenance options available.",
    "commercial_model": "Lease / rental; maintenance optional",
    "availability_evidence": "WesBank states that businesses can rent different types of business vehicles, with a maintenance option or otherwise, from single vehicles to entire fleets.",
    "sources": [
      "https://www.wesbank.co.za/home/lease-agreements/"
    ],
    "confidence_level": "High",
    "notes_uncertainties": "Phase 3 should separate maintenance and non-maintenance variants if evidence supports it."
  },
  {
    "country": "South Africa",
    "provider_name": "WesBank Fleet Management and Leasing",
    "product_name": "Fleet Solutions",
    "product_type": "Fleet funding and management solution",
    "target_customer": "Business and fleet customers",
    "product_description": "Fleet solution covering funding, procurement, management and disposals.",
    "commercial_model": "Managed service / finance solution",
    "availability_evidence": "WesBank publishes fleet solutions covering fleet funding, procurement, fleet management and disposals.",
    "sources": [
      "https://www.wesbank.co.za/home/fleet-solutions/"
    ],
    "confidence_level": "High",
    "notes_uncertainties": "Product boundaries need validation because the page groups several services under fleet solutions."
  },
  {
    "country": "South Africa",
    "provider_name": "Standard Bank Fleet Management",
    "product_name": "Full Maintenance Rental",
    "product_type": "Full maintenance rental / full-maintenance lease equivalent",
    "target_customer": "Business fleet customers",
    "product_description": "Finance and maintenance package for vehicle use over a specified period and distance without taking ownership responsibility.",
    "commercial_model": "Fixed monthly rental; maintenance included",
    "availability_evidence": "Standard Bank describes Full Maintenance Rental as a comprehensive finance and maintenance package without ownership and states customers pay for use over a specified period and kilometres.",
    "sources": [
      "https://www.standardbank.co.za/southafrica/business/products-and-services/business-solutions/fleet-management/full-maintenance-rental"
    ],
    "confidence_level": "High",
    "notes_uncertainties": "Provider uses rental wording; included as close equivalent to full-maintenance lease."
  },
  {
    "country": "South Africa",
    "provider_name": "Standard Bank Fleet Management",
    "product_name": "Operating Rental",
    "product_type": "Operating rental / operating lease equivalent",
    "target_customer": "Business fleet customers",
    "product_description": "Rental option that excludes maintenance management.",
    "commercial_model": "Operating rental",
    "availability_evidence": "Standard Bank states that customers can choose the Operating Rental option if they want to exclude maintenance management.",
    "sources": [
      "https://www.standardbank.co.za/southafrica/business/products-and-services/business-solutions/fleet-management/full-maintenance-rental"
    ],
    "confidence_level": "High",
    "notes_uncertainties": "Captured from Full Maintenance Rental page rather than a separate product page."
  },
  {
    "country": "South Africa",
    "provider_name": "Absa Vehicle Management Solutions",
    "product_name": "Finance Lease",
    "product_type": "Finance lease",
    "target_customer": "Business customers financing vehicles or movable assets",
    "product_description": "Absa purchases the asset and the customer leases it, with options at the end of the lease period.",
    "commercial_model": "Finance lease",
    "availability_evidence": "Absa states that with finance lease it purchases an asset and the customer leases it from Absa, with an option to buy at the end of the lease period.",
    "sources": [
      "https://www.absa.co.za/business/funding-my-business/vehicle-and-asset-finance/absa-financial-lease/"
    ],
    "confidence_level": "High",
    "notes_uncertainties": "Applies to movable assets including vehicles; vehicle-specific terms should be validated in contract/product brochures."
  },
  {
    "country": "South Africa",
    "provider_name": "Absa Vehicle Management Solutions",
    "product_name": "Operating Lease Agreement",
    "product_type": "Operating lease",
    "target_customer": "Business vehicle customers",
    "product_description": "Lease agreement giving full use of the vehicle for the lease period with repayment options.",
    "commercial_model": "Operating lease",
    "availability_evidence": "Absa comparison page lists Operating Lease Agreement and says it provides full use of the vehicle for the lease period.",
    "sources": [
      "https://www.absa.co.za/business/funding-my-business/vehicle-and-asset-finance/compare/"
    ],
    "confidence_level": "High",
    "notes_uncertainties": "Maintenance inclusion not established from this source."
  },
  {
    "country": "South Africa",
    "provider_name": "Absa Vehicle Management Solutions",
    "product_name": "Full Maintenance Lease",
    "product_type": "Full maintenance lease",
    "target_customer": "Business and fleet customers",
    "product_description": "Lease product that combines vehicle use with maintenance services.",
    "commercial_model": "Full maintenance lease",
    "availability_evidence": "Absa business vehicle and asset finance pages disclose full maintenance leases among available packages.",
    "sources": [
      "https://www.absa.co.za/business/funding-my-business/vehicle-and-asset-finance/explore/"
    ],
    "confidence_level": "Medium",
    "notes_uncertainties": "Detailed public product page not found in this pass; confirm current terms before functionality extraction."
  },
  {
    "country": "South Africa",
    "provider_name": "Eqstra",
    "product_name": "Full Maintenance Leasing",
    "product_type": "Full maintenance lease",
    "target_customer": "Commercial vehicle fleet owners and logistics/fleet customers",
    "product_description": "Full maintenance leasing across vehicle classes, including acquisition, maintenance and fleet administration support.",
    "commercial_model": "Fixed monthly lease payment; maintenance, servicing and tyres included",
    "availability_evidence": "Eqstra states that full maintenance leasing manages the expenses of acquiring, maintaining and administering a vehicle fleet and includes maintenance, servicing and tyre replacements in the monthly lease payment.",
    "sources": [
      "https://www.eqstra.co.za/leasing"
    ],
    "confidence_level": "High",
    "notes_uncertainties": "No separate operating lease product confirmed on current official page in this pass."
  },
  {
    "country": "South Africa",
    "provider_name": "Merchant West Fleet",
    "product_name": "Full Maintenance Lease",
    "product_type": "Full maintenance lease",
    "target_customer": "Business fleet customers",
    "product_description": "Lease product with fixed costs and comprehensive vehicle management coverage.",
    "commercial_model": "Full maintenance lease; fixed monthly costs",
    "availability_evidence": "Merchant West states its Full Maintenance Lease covers a fixed period or mileage and includes procurement, maintenance and disposal support.",
    "sources": [
      "https://merchantwest.co.za/fleet/full-maintenance-lease/"
    ],
    "confidence_level": "High",
    "notes_uncertainties": "Some duplicate Merchant West URLs exist; this record uses the current official page found in search."
  },
  {
    "country": "South Africa",
    "provider_name": "Merchant West Fleet",
    "product_name": "Operating Lease",
    "product_type": "Operating lease",
    "target_customer": "Business fleet customers",
    "product_description": "Lease for using vehicles over an agreed term with fixed monthly rentals and no residual risk at the end.",
    "commercial_model": "Operating lease; typically 12-60 months",
    "availability_evidence": "Merchant West states that an Operating Lease lets a business use vehicles for an agreed term, typically 12 to 60 months, with fixed rentals and no residual risk.",
    "sources": [
      "https://merchantwest.co.za/fleet/operating-lease-south-africa/"
    ],
    "confidence_level": "High",
    "notes_uncertainties": ""
  },
  {
    "country": "South Africa",
    "provider_name": "Merchant West Fleet",
    "product_name": "Dynamic Lease",
    "product_type": "Lease-to-own",
    "target_customer": "Businesses wanting eventual ownership",
    "product_description": "Structured lease-to-own solution where the business uses vehicles during the term and takes ownership at the end after payments are complete.",
    "commercial_model": "Lease-to-own; fixed monthly rental",
    "availability_evidence": "Merchant West describes Dynamic Lease as a lease-to-own structure with ownership transferring after all contractual payments are made.",
    "sources": [
      "https://merchantwest.co.za/fleet/dynamic-lease/"
    ],
    "confidence_level": "High",
    "notes_uncertainties": "Maintenance and tyres are customer responsibility according to provider FAQ."
  },
  {
    "country": "South Africa",
    "provider_name": "Avis Fleet",
    "product_name": "Full Maintenance Lease",
    "product_type": "Full maintenance lease",
    "target_customer": "Corporate and outsourced fleet customers",
    "product_description": "Outsourced fleet purchasing and management solution where Avis Fleet supports vehicle sourcing and fleet lifecycle services.",
    "commercial_model": "Full maintenance lease / outsourced fleet management",